date,title,source,date_raw,title_clean,title_lower
2025-06-20 11:00:00+00:00,"Dot Ai, Innovator in Asset Intelligence Technology, Completes Business Combination; Will Begin Trading on Nasdaq Stock Market - Business Wire",Business Wire,"Fri, 20 Jun 2025 11:00:00 GMT","Dot Ai, Innovator in Asset Intelligence Technology, Completes Business Combination; Will Begin Trading on Nasdaq Stock Market","dot ai, innovator in asset intelligence technology, completes business combination; will begin trading on nasdaq stock market"
2025-06-20 11:38:08+00:00,5 Things to Know Before the Stock Market Opens - Investopedia,Investopedia,"Fri, 20 Jun 2025 11:38:08 GMT",5 Things to Know Before the Stock Market Opens,5 things to know before the stock market opens
2025-06-20 13:10:15+00:00,5 things to know before the stock market opens Friday - CNBC,CNBC,"Fri, 20 Jun 2025 13:10:15 GMT",5 things to know before the stock market opens Friday,5 things to know before the stock market opens friday
2025-06-20 19:07:30+00:00,"S&P 500 posts third straight losing day as traders eye Middle East tensions, Trump’s next steps: Live updates - CNBC",CNBC,"Fri, 20 Jun 2025 19:07:30 GMT","S&P 500 posts third straight losing day as traders eye Middle East tensions, Trump’s next steps: Live updates","s&p 500 posts third straight losing day as traders eye middle east tensions, trump’s next steps: live updates"
2025-06-20 20:23:00+00:00,"Stock Market News, June 20, 2025: Dow ekes out gain, S&P 500 and Nasdaq end lower as investors approach the weekend with worries over Middle East - MarketWatch",MarketWatch,"Fri, 20 Jun 2025 20:23:00 GMT","Stock Market News, June 20, 2025: Dow ekes out gain, S&P 500 and Nasdaq end lower as investors approach the weekend with worries over Middle East","stock market news, june 20, 2025: dow ekes out gain, s&p 500 and nasdaq end lower as investors approach the weekend with worries over middle east"
2025-06-20 22:02:41+00:00,"Stock market today: S&P 500, Nasdaq fall amid Fed rate uncertainty as Trump mulls Iran move - Yahoo Finance",Yahoo Finance,"Fri, 20 Jun 2025 22:02:41 GMT","Stock market today: S&P 500, Nasdaq fall amid Fed rate uncertainty as Trump mulls Iran move","stock market today: s&p 500, nasdaq fall amid fed rate uncertainty as trump mulls iran move"
2025-06-20 22:08:00+00:00,"Stock Market News From June 20, 2025: S&P 500, Nasdaq Slide After Trump Gives Markets Hope Over Iran - Barron's",Barron's,"Fri, 20 Jun 2025 22:08:00 GMT","Stock Market News From June 20, 2025: S&P 500, Nasdaq Slide After Trump Gives Markets Hope Over Iran","stock market news from june 20, 2025: s&p 500, nasdaq slide after trump gives markets hope over iran"
2025-06-20 22:41:09+00:00,"S&P 500, Nasdaq finish lower; investors uneasy about Middle East conflict - Reuters",Reuters,"Fri, 20 Jun 2025 22:41:09 GMT","S&P 500, Nasdaq finish lower; investors uneasy about Middle East conflict","s&p 500, nasdaq finish lower; investors uneasy about middle east conflict"
2025-06-21 00:14:00+00:00,"Stock Market News June 20, 2025: Oil Prices Drop Friday After Trump Signals He'll Give Iran Negotiations Time - WSJ",WSJ,"Sat, 21 Jun 2025 00:14:00 GMT","Stock Market News June 20, 2025: Oil Prices Drop Friday After Trump Signals He'll Give Iran Negotiations Time","stock market news june 20, 2025: oil prices drop friday after trump signals he'll give iran negotiations time"
