date,title,source,date_raw,title_clean,title_lower
2025-04-10 07:00:00+00:00,How a Global Trade War Hurts the U.S. Stock Market - Poole College of Management,Poole College of Management,"Thu, 10 Apr 2025 07:00:00 GMT",How a Global Trade War Hurts the U.S. Stock Market,how a global trade war hurts the u.s. stock market
2025-04-10 07:00:00+00:00,"US stocks, dollar tumble as Trump’s trade war rattles Wall Street - CNN",CNN,"Thu, 10 Apr 2025 07:00:00 GMT","US stocks, dollar tumble as Trump’s trade war rattles Wall Street","us stocks, dollar tumble as trump’s trade war rattles wall street"
2025-04-10 07:00:00+00:00,"Stock market today: Dow slides 1,000 points, Nasdaq, S&P 500 clobbered as stocks resume Trump tariff sell-off - Yahoo Finance",Yahoo Finance,"Thu, 10 Apr 2025 07:00:00 GMT","Stock market today: Dow slides 1,000 points, Nasdaq, S&P 500 clobbered as stocks resume Trump tariff sell","stock market today: dow slides 1,000 points, nasdaq, s&p 500 clobbered as stocks resume trump tariff sell"
2025-04-11 07:00:00+00:00,"Tech Stocks Soared This Week, but Uncertainty Persists - The Motley Fool",The Motley Fool,"Fri, 11 Apr 2025 07:00:00 GMT","Tech Stocks Soared This Week, but Uncertainty Persists","tech stocks soared this week, but uncertainty persists"
2025-04-11 07:00:00+00:00,Good Friday Stock Market Holiday Facts - Nasdaq,Nasdaq,"Fri, 11 Apr 2025 07:00:00 GMT",Good Friday Stock Market Holiday Facts,good friday stock market holiday facts
2025-04-11 07:00:00+00:00,We’ve Been Through Market Corrections Before. Here’s What We’re Doing Now. - Morningstar,Morningstar,"Fri, 11 Apr 2025 07:00:00 GMT",We’ve Been Through Market Corrections Before. Here’s What We’re Doing Now.,we’ve been through market corrections before. here’s what we’re doing now.
2025-04-11 07:00:00+00:00,"Battered big technology stocks like Nvidia can be havens in disguise, says this fund manager - MarketWatch",MarketWatch,"Fri, 11 Apr 2025 07:00:00 GMT","Battered big technology stocks like Nvidia can be havens in disguise, says this fund manager","battered big technology stocks like nvidia can be havens in disguise, says this fund manager"
2025-04-13 07:00:00+00:00,Here’s Savvy Advice on What to Do With Tech Stocks Now - Barron's,Barron's,"Sun, 13 Apr 2025 07:00:00 GMT",Here’s Savvy Advice on What to Do With Tech Stocks Now,here’s savvy advice on what to do with tech stocks now
2025-04-13 07:00:00+00:00,Asian tech stocks bounce back after Trump tariff exemptions - Reuters,Reuters,"Sun, 13 Apr 2025 07:00:00 GMT",Asian tech stocks bounce back after Trump tariff exemptions,asian tech stocks bounce back after trump tariff exemptions
2025-04-14 07:00:00+00:00,Wall Street ends higher with Apple shares as investors assess tariff exemptions - Reuters,Reuters,"Mon, 14 Apr 2025 07:00:00 GMT",Wall Street ends higher with Apple shares as investors assess tariff exemptions,wall street ends higher with apple shares as investors assess tariff exemptions
2025-04-14 07:00:00+00:00,US markets: Tech stocks rise higher and investors watch earnings - Euronews.com,Euronews.com,"Mon, 14 Apr 2025 07:00:00 GMT",US markets: Tech stocks rise higher and investors watch earnings,us markets: tech stocks rise higher and investors watch earnings
2025-04-14 07:00:00+00:00,"Opinion: 7 tech stocks to consider buying now, after the Nasdaq’s slump - MarketWatch",MarketWatch,"Mon, 14 Apr 2025 07:00:00 GMT","Opinion: 7 tech stocks to consider buying now, after the Nasdaq’s slump","opinion: 7 tech stocks to consider buying now, after the nasdaq’s slump"
2025-04-14 07:00:00+00:00,"Tech, auto shares gain as Trump floats more tariff exemptions amid confusion - Reuters",Reuters,"Mon, 14 Apr 2025 07:00:00 GMT","Tech, auto shares gain as Trump floats more tariff exemptions amid confusion","tech, auto shares gain as trump floats more tariff exemptions amid confusion"
2025-04-14 07:00:00+00:00,Tariffs tanked the stock market. Did investors panic and sell? Here's the data. - USA Today,USA Today,"Mon, 14 Apr 2025 07:00:00 GMT",Tariffs tanked the stock market. Did investors panic and sell? Here's the data.,tariffs tanked the stock market. did investors panic and sell? here's the data.
2025-04-14 07:00:00+00:00,"Apple, Dell, and Other Tech Stocks Climb on Tariff Exemptions - Investopedia",Investopedia,"Mon, 14 Apr 2025 07:00:00 GMT","Apple, Dell, and Other Tech Stocks Climb on Tariff Exemptions","apple, dell, and other tech stocks climb on tariff exemptions"
2025-04-15 07:00:00+00:00,2 Top Tech Stocks That Could Make You a Millionaire - The Motley Fool,The Motley Fool,"Tue, 15 Apr 2025 07:00:00 GMT",2 Top Tech Stocks That Could Make You a Millionaire,2 top tech stocks that could make you a millionaire
2025-04-16 07:00:00+00:00,Tech stocks sink after Nvidia reveals hit from US curbs on sales to China - Financial Times,Financial Times,"Wed, 16 Apr 2025 07:00:00 GMT",Tech stocks sink after Nvidia reveals hit from US curbs on sales to China,tech stocks sink after nvidia reveals hit from us curbs on sales to china
2025-04-16 07:00:00+00:00,"Tech stocks struggle after U.S., China trade tensions intensify - MarketWatch",MarketWatch,"Wed, 16 Apr 2025 07:00:00 GMT","Tech stocks struggle after U.S., China trade tensions intensify","tech stocks struggle after u.s., china trade tensions intensify"
2025-04-16 07:00:00+00:00,Is Bitcoin Trading Like Tech Stocks? - Morningstar,Morningstar,"Wed, 16 Apr 2025 07:00:00 GMT",Is Bitcoin Trading Like Tech Stocks?,is bitcoin trading like tech stocks?
2025-04-16 07:00:00+00:00,Why Tech Stocks Crashed on Wednesday - The Motley Fool,The Motley Fool,"Wed, 16 Apr 2025 07:00:00 GMT",Why Tech Stocks Crashed on Wednesday,why tech stocks crashed on wednesday
2025-04-16 07:00:00+00:00,"Trade Tensions Weigh Down Nvidia, Tech Stocks - WSJ",WSJ,"Wed, 16 Apr 2025 07:00:00 GMT","Trade Tensions Weigh Down Nvidia, Tech Stocks","trade tensions weigh down nvidia, tech stocks"
2025-04-16 07:00:00+00:00,S&P 500 sinks as tech stocks fall amid thickening fog of Trump’s trade war - PBS,PBS,"Wed, 16 Apr 2025 07:00:00 GMT",S&P 500 sinks as tech stocks fall amid thickening fog of Trump’s trade war,s&p 500 sinks as tech stocks fall amid thickening fog of trump’s trade war
2025-04-16 07:00:00+00:00,"Stock Market News, April 16, 2025: Nasdaq Slides 3% After U.S. Tightens Curbs on Nvidia's China Exports - WSJ",WSJ,"Wed, 16 Apr 2025 07:00:00 GMT","Stock Market News, April 16, 2025: Nasdaq Slides 3% After U.S. Tightens Curbs on Nvidia's China Exports","stock market news, april 16, 2025: nasdaq slides 3% after u.s. tightens curbs on nvidia's china exports"
2025-04-17 07:00:00+00:00,2 Top Tech Stocks to Buy in April - The Motley Fool,The Motley Fool,"Thu, 17 Apr 2025 07:00:00 GMT",2 Top Tech Stocks to Buy in April,2 top tech stocks to buy in april
2025-04-17 07:00:00+00:00,Chinese tea chain Chagee valued at $6.2 billion as shares pop in Nasdaq debut - Reuters,Reuters,"Thu, 17 Apr 2025 07:00:00 GMT",Chinese tea chain Chagee valued at $6.2 billion as shares pop in Nasdaq debut,chinese tea chain chagee valued at $6.2 billion as shares pop in nasdaq debut
2025-04-17 07:00:00+00:00,"Calmer Volatility Points to Gains for Energy, Tech Stocks - Bloomberg",Bloomberg,"Thu, 17 Apr 2025 07:00:00 GMT","Calmer Volatility Points to Gains for Energy, Tech Stocks","calmer volatility points to gains for energy, tech stocks"
2025-04-18 07:00:00+00:00,Why Meta is one of the most compelling tech stocks right now - MarketWatch,MarketWatch,"Fri, 18 Apr 2025 07:00:00 GMT",Why Meta is one of the most compelling tech stocks right now,why meta is one of the most compelling tech stocks right now
2025-04-18 07:00:00+00:00,These 15 tech stocks could rocket up to 85% in a year — and analysts love them - MarketWatch,MarketWatch,"Fri, 18 Apr 2025 07:00:00 GMT",These 15 tech stocks could rocket up to 85% in a year — and analysts love them,these 15 tech stocks could rocket up to 85% in a year — and analysts love them
2025-04-22 07:00:00+00:00,"Tariff Turmoil: 1 Unstoppable Stock to Buy With $1,000 During the Nasdaq Bear Market - Nasdaq",Nasdaq,"Tue, 22 Apr 2025 07:00:00 GMT","Tariff Turmoil: 1 Unstoppable Stock to Buy With $1,000 During the Nasdaq Bear Market","tariff turmoil: 1 unstoppable stock to buy with $1,000 during the nasdaq bear market"
2025-04-23 07:00:00+00:00,Why American tech stocks are newly vulnerable - The Economist,The Economist,"Wed, 23 Apr 2025 07:00:00 GMT",Why American tech stocks are newly vulnerable,why american tech stocks are newly vulnerable
2025-04-23 07:00:00+00:00,S&P 500 Gains and Losses Today: Tech Stocks Jump as Trump Softens Stance on Fed and Trade - Investopedia,Investopedia,"Wed, 23 Apr 2025 07:00:00 GMT",S&P 500 Gains and Losses Today: Tech Stocks Jump as Trump Softens Stance on Fed and Trade,s&p 500 gains and losses today: tech stocks jump as trump softens stance on fed and trade
2025-04-24 07:00:00+00:00,"Wall Street ends higher on tech boost, easing tariff tensions - Reuters",Reuters,"Thu, 24 Apr 2025 07:00:00 GMT","Wall Street ends higher on tech boost, easing tariff tensions","wall street ends higher on tech boost, easing tariff tensions"
2025-04-24 07:00:00+00:00,Has the stock market hit bottom? History is a guide - CNN,CNN,"Thu, 24 Apr 2025 07:00:00 GMT",Has the stock market hit bottom? History is a guide,has the stock market hit bottom? history is a guide
2025-04-24 07:00:00+00:00,"Nasdaq beats Q1 profit estimates on market volatility, strong product demand - Reuters",Reuters,"Thu, 24 Apr 2025 07:00:00 GMT","Nasdaq beats Q1 profit estimates on market volatility, strong product demand","nasdaq beats q1 profit estimates on market volatility, strong product demand"
2025-04-24 07:00:00+00:00,Tech Shares Drive Stocks Higher for a Third Straight Session - WSJ,WSJ,"Thu, 24 Apr 2025 07:00:00 GMT",Tech Shares Drive Stocks Higher for a Third Straight Session,tech shares drive stocks higher for a third straight session
2025-04-24 07:00:00+00:00,Tariff Turbulence: How Risky Are Tech Stocks Right Now? - The Motley Fool,The Motley Fool,"Thu, 24 Apr 2025 07:00:00 GMT",Tariff Turbulence: How Risky Are Tech Stocks Right Now?,tariff turbulence: how risky are tech stocks right now?
2025-04-25 07:00:00+00:00,"Stock Market News, April 25, 2025: Nasdaq Climbs More Than 1% as Stocks Finish Strong Week - WSJ",WSJ,"Fri, 25 Apr 2025 07:00:00 GMT","Stock Market News, April 25, 2025: Nasdaq Climbs More Than 1% as Stocks Finish Strong Week","stock market news, april 25, 2025: nasdaq climbs more than 1% as stocks finish strong week"
2025-04-25 07:00:00+00:00,Stocks Finish Sharply Higher on Tech Stock Strength and Fed Rate Cut Hopes - Nasdaq,Nasdaq,"Fri, 25 Apr 2025 07:00:00 GMT",Stocks Finish Sharply Higher on Tech Stock Strength and Fed Rate Cut Hopes,stocks finish sharply higher on tech stock strength and fed rate cut hopes
2025-04-26 07:00:00+00:00,NDAQ Stock Price and Chart — NASDAQ:NDAQ - TradingView,TradingView,"Sat, 26 Apr 2025 07:00:00 GMT",NDAQ Stock Price and Chart — NASDAQ:NDAQ,ndaq stock price and chart — nasdaq:ndaq
2025-04-26 07:00:00+00:00,It’s time to buy tech stocks: 4 ways to find winners while the market is down - MarketWatch,MarketWatch,"Sat, 26 Apr 2025 07:00:00 GMT",It’s time to buy tech stocks: 4 ways to find winners while the market is down,it’s time to buy tech stocks: 4 ways to find winners while the market is down
2025-04-28 07:00:00+00:00,Stocks Finish Higher as Megacap Tech Stocks Rally - Nasdaq,Nasdaq,"Mon, 28 Apr 2025 07:00:00 GMT",Stocks Finish Higher as Megacap Tech Stocks Rally,stocks finish higher as megacap tech stocks rally
2025-04-29 07:00:00+00:00,Stock Market Today: Dow Rises After Commerce Secretary Hints at Trade Progress - WSJ,WSJ,"Tue, 29 Apr 2025 07:00:00 GMT",Stock Market Today: Dow Rises After Commerce Secretary Hints at Trade Progress,stock market today: dow rises after commerce secretary hints at trade progress
2025-04-29 07:00:00+00:00,The stock market’s worst first 100 days of any presidential term in more than 50 years - CNN,CNN,"Tue, 29 Apr 2025 07:00:00 GMT",The stock market’s worst first 100 days of any presidential term in more than 50 years,the stock market’s worst first 100 days of any presidential term in more than 50 years
2025-04-29 07:00:00+00:00,Stock Market Outlook: Bull Market May Not Be Finished - Morgan Stanley,Morgan Stanley,"Tue, 29 Apr 2025 07:00:00 GMT",Stock Market Outlook: Bull Market May Not Be Finished,stock market outlook: bull market may not be finished
2025-04-29 07:00:00+00:00,10% Returns in the Stock Market - A Wealth of Common Sense,A Wealth of Common Sense,"Tue, 29 Apr 2025 07:00:00 GMT",10% Returns in the Stock Market,10% returns in the stock market
2025-04-30 07:00:00+00:00,"Got $5,000? 2 Tech Stocks to Buy and Hold for the Long Term - The Motley Fool",The Motley Fool,"Wed, 30 Apr 2025 07:00:00 GMT","Got $5,000? 2 Tech Stocks to Buy and Hold for the Long Term","got $5,000? 2 tech stocks to buy and hold for the long term"
2025-04-30 07:00:00+00:00,Team and Nasdaq Join Forces to Accelerate Innovation - Mercedes-AMG PETRONAS F1 Team,Mercedes-AMG PETRONAS F1 Team,"Wed, 30 Apr 2025 07:00:00 GMT",Team and Nasdaq Join Forces to Accelerate Innovation,team and nasdaq join forces to accelerate innovation
2025-04-30 07:00:00+00:00,100 days: The US stock market's rollercoaster ride since Trump took office - CNN,CNN,"Wed, 30 Apr 2025 07:00:00 GMT",100 days: The US stock market's rollercoaster ride since Trump took office,100 days: the us stock market's rollercoaster ride since trump took office
2025-05-01 07:00:00+00:00,Nasdaq Plan Will Bring Zero-Day Option Boom Closer to Single Stocks - Bloomberg,Bloomberg,"Thu, 01 May 2025 07:00:00 GMT",Nasdaq Plan Will Bring Zero,nasdaq plan will bring zero
2025-05-01 07:00:00+00:00,"Apple, Amazon shares slip after hours; tech shares jump earlier - Reuters",Reuters,"Thu, 01 May 2025 07:00:00 GMT","Apple, Amazon shares slip after hours; tech shares jump earlier","apple, amazon shares slip after hours; tech shares jump earlier"
2025-05-01 07:00:00+00:00,Big Tech Stocks Have Had a Magnificent Day So Far - Investopedia,Investopedia,"Thu, 01 May 2025 07:00:00 GMT",Big Tech Stocks Have Had a Magnificent Day So Far,big tech stocks have had a magnificent day so far
2025-05-01 07:00:00+00:00,3 Tech Stocks You Can Buy and Hold for the Next Decade - The Motley Fool,The Motley Fool,"Thu, 01 May 2025 07:00:00 GMT",3 Tech Stocks You Can Buy and Hold for the Next Decade,3 tech stocks you can buy and hold for the next decade
2025-05-02 07:00:00+00:00,Strong Earnings Helped Tech Stocks Shake Off Tariff Worries to Log an Upbeat Week - Investopedia,Investopedia,"Fri, 02 May 2025 07:00:00 GMT",Strong Earnings Helped Tech Stocks Shake Off Tariff Worries to Log an Upbeat Week,strong earnings helped tech stocks shake off tariff worries to log an upbeat week
2025-05-05 07:00:00+00:00,Nvidia and these other tech stocks look like winners this earnings season - MarketWatch,MarketWatch,"Mon, 05 May 2025 07:00:00 GMT",Nvidia and these other tech stocks look like winners this earnings season,nvidia and these other tech stocks look like winners this earnings season
2025-05-06 07:00:00+00:00,2 Tech Stocks That Could Help Set You Up for Life - The Motley Fool,The Motley Fool,"Tue, 06 May 2025 07:00:00 GMT",2 Tech Stocks That Could Help Set You Up for Life,2 tech stocks that could help set you up for life
2025-05-06 07:00:00+00:00,May 2025 US Stock Market Outlook: Eye of the Hurricane - Morningstar,Morningstar,"Tue, 06 May 2025 07:00:00 GMT",May 2025 US Stock Market Outlook: Eye of the Hurricane,may 2025 us stock market outlook: eye of the hurricane
2025-05-06 07:00:00+00:00,10 tech stocks that could rally up to 41% — and make good use of your money - MarketWatch,MarketWatch,"Tue, 06 May 2025 07:00:00 GMT",10 tech stocks that could rally up to 41% — and make good use of your money,10 tech stocks that could rally up to 41% — and make good use of your money
2025-05-07 07:00:00+00:00,"Stock market today: Dow, S&P 500, Nasdaq rise as Fed holds rates steady, Powell sticks to 'wait and see' - Yahoo Finance",Yahoo Finance,"Wed, 07 May 2025 07:00:00 GMT","Stock market today: Dow, S&P 500, Nasdaq rise as Fed holds rates steady, Powell sticks to 'wait and see'","stock market today: dow, s&p 500, nasdaq rise as fed holds rates steady, powell sticks to 'wait and see'"
2025-05-11 07:00:00+00:00,Big news missing the big picture: Stock market performance in the news - CEPR,CEPR,"Sun, 11 May 2025 07:00:00 GMT",Big news missing the big picture: Stock market performance in the news,big news missing the big picture: stock market performance in the news
2025-05-12 07:00:00+00:00,"Stock market today: Dow jumps 1,100 points, S&P 500 and Nasdaq surge after US-China tariff rollback triggers buying spree - Yahoo Finance",Yahoo Finance,"Mon, 12 May 2025 07:00:00 GMT","Stock market today: Dow jumps 1,100 points, S&P 500 and Nasdaq surge after US","stock market today: dow jumps 1,100 points, s&p 500 and nasdaq surge after us"
2025-05-12 07:00:00+00:00,"Stock Market News May 12, 2025: Dow ends up 1160 points, Nasdaq exits bear market as U.S. and China slash tariffs for 90 days - MarketWatch",MarketWatch,"Mon, 12 May 2025 07:00:00 GMT","Stock Market News May 12, 2025: Dow ends up 1160 points, Nasdaq exits bear market as U.S. and China slash tariffs for 90 days","stock market news may 12, 2025: dow ends up 1160 points, nasdaq exits bear market as u.s. and china slash tariffs for 90 days"
2025-05-12 07:00:00+00:00,Tech Stocks Rally on US-China Trade Deal - Investopedia,Investopedia,"Mon, 12 May 2025 07:00:00 GMT",Tech Stocks Rally on US,tech stocks rally on us
2025-05-12 07:00:00+00:00,"Amazon, Meta, Alphabet, Other Tech Stocks Rise. Stay Cautious. - Barron's",Barron's,"Mon, 12 May 2025 07:00:00 GMT","Amazon, Meta, Alphabet, Other Tech Stocks Rise. Stay Cautious.","amazon, meta, alphabet, other tech stocks rise. stay cautious."
2025-05-12 07:00:00+00:00,These 10 tech stocks could benefit most from softening U.S.-China tariffs - MarketWatch,MarketWatch,"Mon, 12 May 2025 07:00:00 GMT",These 10 tech stocks could benefit most from softening U.S.,these 10 tech stocks could benefit most from softening u.s.
2025-05-12 07:00:00+00:00,Tech stocks are back in a bull market as Nvidia and Tesla soar - Business Insider,Business Insider,"Mon, 12 May 2025 07:00:00 GMT",Tech stocks are back in a bull market as Nvidia and Tesla soar,tech stocks are back in a bull market as nvidia and tesla soar
2025-05-13 07:00:00+00:00,Stock market today: S&P 500 wipes out 2025 losses as Nvidia powers tech rally - Yahoo Finance,Yahoo Finance,"Tue, 13 May 2025 07:00:00 GMT",Stock market today: S&P 500 wipes out 2025 losses as Nvidia powers tech rally,stock market today: s&p 500 wipes out 2025 losses as nvidia powers tech rally
2025-05-13 07:00:00+00:00,2 Tech Stocks You Can Buy and Hold for the Next Decade - Nasdaq,Nasdaq,"Tue, 13 May 2025 07:00:00 GMT",2 Tech Stocks You Can Buy and Hold for the Next Decade,2 tech stocks you can buy and hold for the next decade
2025-05-13 07:00:00+00:00,Capital Market Technology & Business Solutions | Nasdaq Eqlipse - Nasdaq,Nasdaq,"Tue, 13 May 2025 07:00:00 GMT",Capital Market Technology & Business Solutions,capital market technology & business solutions
2025-05-13 07:00:00+00:00,S&P 500 Gains & Losses Today: Index Extends Gains as Tech Stocks Surge - Investopedia,Investopedia,"Tue, 13 May 2025 07:00:00 GMT",S&P 500 Gains & Losses Today: Index Extends Gains as Tech Stocks Surge,s&p 500 gains & losses today: index extends gains as tech stocks surge
2025-05-13 07:00:00+00:00,"S&P 500, Nasdaq end higher on soft inflation data, trade optimism - Reuters",Reuters,"Tue, 13 May 2025 07:00:00 GMT","S&P 500, Nasdaq end higher on soft inflation data, trade optimism","s&p 500, nasdaq end higher on soft inflation data, trade optimism"
2025-05-14 07:00:00+00:00,3 Top Tech Stocks That Could Make You a Millionaire - Nasdaq,Nasdaq,"Wed, 14 May 2025 07:00:00 GMT",3 Top Tech Stocks That Could Make You a Millionaire,3 top tech stocks that could make you a millionaire
2025-05-14 07:00:00+00:00,Newly issued eToro shares jump in Nasdaq debut. It’s a bullish sign for IPOs. - MarketWatch,MarketWatch,"Wed, 14 May 2025 07:00:00 GMT",Newly issued eToro shares jump in Nasdaq debut. It’s a bullish sign for IPOs.,newly issued etoro shares jump in nasdaq debut. it’s a bullish sign for ipos.
2025-05-14 07:00:00+00:00,Stocks fluctuate as 2025 losses erased; tech stocks rebound - InvestmentNews,InvestmentNews,"Wed, 14 May 2025 07:00:00 GMT",Stocks fluctuate as 2025 losses erased; tech stocks rebound,stocks fluctuate as 2025 losses erased; tech stocks rebound
2025-05-14 07:00:00+00:00,Daily: Tech rebound has more to go - UBS,UBS,"Wed, 14 May 2025 07:00:00 GMT",Daily: Tech rebound has more to go,daily: tech rebound has more to go
2025-05-14 07:00:00+00:00,Trump gives tech stocks their first Gulf-driven rally - Middle East Eye,Middle East Eye,"Wed, 14 May 2025 07:00:00 GMT",Trump gives tech stocks their first Gulf,trump gives tech stocks their first gulf
2025-05-15 07:00:00+00:00,A Nasdaq Bull Market Is Coming. 3 Things You Should Do Before It Arrives. - Nasdaq,Nasdaq,"Thu, 15 May 2025 07:00:00 GMT",A Nasdaq Bull Market Is Coming. 3 Things You Should Do Before It Arrives.,a nasdaq bull market is coming. 3 things you should do before it arrives.
2025-05-16 07:00:00+00:00,What to make of the stock market’s recovery - MarketWatch,MarketWatch,"Fri, 16 May 2025 07:00:00 GMT",What to make of the stock market’s recovery,what to make of the stock market’s recovery
2025-05-16 07:00:00+00:00,"Got $5,000? 3 Tech Stocks to Buy and Hold for the Long Term - The Motley Fool",The Motley Fool,"Fri, 16 May 2025 07:00:00 GMT","Got $5,000? 3 Tech Stocks to Buy and Hold for the Long Term","got $5,000? 3 tech stocks to buy and hold for the long term"
2025-05-16 07:00:00+00:00,"Stock market today: S&P 500 notches 5-day win streak, Nasdaq gains 7% for week as Wall Street shakes off trade war worries - Yahoo Finance",Yahoo Finance,"Fri, 16 May 2025 07:00:00 GMT",Stock market today: S&P 500 notches 5,stock market today: s&p 500 notches 5
2025-05-16 07:00:00+00:00,"Stock Market News, May 16, 2025: Stocks Rise After Trump Unveils New Tariff Wrinkle - WSJ",WSJ,"Fri, 16 May 2025 07:00:00 GMT","Stock Market News, May 16, 2025: Stocks Rise After Trump Unveils New Tariff Wrinkle","stock market news, may 16, 2025: stocks rise after trump unveils new tariff wrinkle"
2025-05-16 07:00:00+00:00,3 Top Tech Stocks to Buy in May - The Motley Fool,The Motley Fool,"Fri, 16 May 2025 07:00:00 GMT",3 Top Tech Stocks to Buy in May,3 top tech stocks to buy in may
2025-05-16 07:00:00+00:00,Mike Novogratz's Galaxy Digital debuts on Nasdaq in bumper week for crypto - Reuters,Reuters,"Fri, 16 May 2025 07:00:00 GMT",Mike Novogratz's Galaxy Digital debuts on Nasdaq in bumper week for crypto,mike novogratz's galaxy digital debuts on nasdaq in bumper week for crypto
2025-05-16 07:00:00+00:00,Why tech stocks could keep rallying - Goldman Sachs,Goldman Sachs,"Fri, 16 May 2025 07:00:00 GMT",Why tech stocks could keep rallying,why tech stocks could keep rallying
2025-05-16 07:00:00+00:00,US stock market gains may slow after torrid rebound from tariff swoon - Reuters,Reuters,"Fri, 16 May 2025 07:00:00 GMT",US stock market gains may slow after torrid rebound from tariff swoon,us stock market gains may slow after torrid rebound from tariff swoon
2025-05-19 07:00:00+00:00,3 Reasons Trump’s Tariffs Are Tanking The Stock Market - Poole College of Management,Poole College of Management,"Mon, 19 May 2025 07:00:00 GMT",3 Reasons Trump’s Tariffs Are Tanking The Stock Market,3 reasons trump’s tariffs are tanking the stock market
2025-05-19 07:00:00+00:00,"Stock market today: S&P 500 notches 6-day win streak, Dow, Nasdaq rise as Wall Street shakes off Moody's downgrade - Yahoo Finance",Yahoo Finance,"Mon, 19 May 2025 07:00:00 GMT",Stock market today: S&P 500 notches 6,stock market today: s&p 500 notches 6
2025-05-19 07:00:00+00:00,Tech stocks took a hit after the last two U.S. credit downgrades. Why this time could be different. - MarketWatch,MarketWatch,"Mon, 19 May 2025 07:00:00 GMT",Tech stocks took a hit after the last two U.S. credit downgrades. Why this time could be different.,tech stocks took a hit after the last two u.s. credit downgrades. why this time could be different.
2025-05-19 07:00:00+00:00,SAP Hosts Event Today. It’s Europe’s Answer to Big Tech Stocks. - Barron's,Barron's,"Mon, 19 May 2025 07:00:00 GMT",SAP Hosts Event Today. It’s Europe’s Answer to Big Tech Stocks.,sap hosts event today. it’s europe’s answer to big tech stocks.
2025-05-20 07:00:00+00:00,"Stock Market News, May 20, 2025: Tech Stocks Fell, Snapping U.S. Market's Winning Streak - WSJ",WSJ,"Tue, 20 May 2025 07:00:00 GMT","Stock Market News, May 20, 2025: Tech Stocks Fell, Snapping U.S. Market's Winning Streak","stock market news, may 20, 2025: tech stocks fell, snapping u.s. market's winning streak"
2025-05-20 07:00:00+00:00,S&P 500: A New Nasdaq Bull Market Has Begun — 8 Stocks Lead The Charge - Investor's Business Daily,Investor's Business Daily,"Tue, 20 May 2025 07:00:00 GMT",S&P 500: A New Nasdaq Bull Market Has Begun — 8 Stocks Lead The Charge,s&p 500: a new nasdaq bull market has begun — 8 stocks lead the charge
2025-05-21 07:00:00+00:00,Dow sinks 800 points as bond market starts to freak out over Trump’s tax bill - CNN,CNN,"Wed, 21 May 2025 07:00:00 GMT",Dow sinks 800 points as bond market starts to freak out over Trump’s tax bill,dow sinks 800 points as bond market starts to freak out over trump’s tax bill
